{"schema":"highergraphen.architecture.input_lift.report.v1","report_type":"architecture_input_lift","report_version":1,"metadata":{"command":"highergraphen architecture input lift","runtime_package":"higher-graphen-runtime","runtime_crate":"higher_graphen_runtime","cli_package":"highergraphen-cli"},"scenario":{"input_schema":"highergraphen.architecture.input.v1","source":{"kind":"document","uri":"schemas/inputs/architecture-lift.input.example.json","title":"Architecture input lift smoke fixture","captured_at":"2026-04-25T00:00:00Z","confidence":1.0},"space":{"id":"space:architecture-product-input","name":"Architecture Product Input","description":"Bounded JSON fixture for lifting accepted architecture facts.","cell_ids":["cell:order-service","cell:billing-service","cell:billing-db"],"incidence_ids":["incidence:order-service-reads-billing-db","incidence:billing-service-owns-billing-db"],"complex_ids":["complex:architecture-input-lift:space:architecture-product-input"],"context_ids":["context:orders","context:billing"]},"contexts":[{"id":"context:orders","name":"Orders"},{"id":"context:billing","name":"Billing"},{"id":"context:architecture-review","name":"Architecture Review"}],"cells":[{"id":"cell:order-service","space_id":"space:architecture-product-input","dimension":0,"cell_type":"service","label":"Order Service","context_ids":["context:orders"],"provenance":{"source":{"kind":"document","uri":"schemas/inputs/architecture-lift.input.example.json","title":"Architecture input lift smoke fixture","captured_at":"2026-04-25T00:00:00Z","source_local_id":"components.order_service"},"confidence":1.0,"review_status":"accepted","extraction_method":"architecture_input_lift.v1"}},{"id":"cell:billing-service","space_id":"space:architecture-product-input","dimension":0,"cell_type":"service","label":"Billing Service","context_ids":["context:billing"],"provenance":{"source":{"kind":"document","uri":"schemas/inputs/architecture-lift.input.example.json","title":"Architecture input lift smoke fixture","captured_at":"2026-04-25T00:00:00Z","source_local_id":"components.billing_service"},"confidence":1.0,"review_status":"accepted","extraction_method":"architecture_input_lift.v1"}},{"id":"cell:billing-db","space_id":"space:architecture-product-input","dimension":0,"cell_type":"database","label":"Billing DB","context_ids":["context:billing"],"provenance":{"source":{"kind":"document","uri":"schemas/inputs/architecture-lift.input.example.json","title":"Architecture input lift smoke fixture","captured_at":"2026-04-25T00:00:00Z","source_local_id":"components.billing_db"},"confidence":1.0,"review_status":"accepted","extraction_method":"architecture_input_lift.v1"}}],"incidences":[{"id":"incidence:order-service-reads-billing-db","space_id":"space:architecture-product-input","from_cell_id":"cell:order-service","to_cell_id":"cell:billing-db","relation_type":"reads_database","orientation":"directed","provenance":{"source":{"kind":"document","uri":"schemas/inputs/architecture-lift.input.example.json","title":"Architecture input lift smoke fixture","captured_at":"2026-04-25T00:00:00Z","source_local_id":"relations.order_reads_billing_db"},"confidence":0.95,"review_status":"accepted","extraction_method":"architecture_input_lift.v1"}},{"id":"incidence:billing-service-owns-billing-db","space_id":"space:architecture-product-input","from_cell_id":"cell:billing-service","to_cell_id":"cell:billing-db","relation_type":"owns_database","orientation":"directed","provenance":{"source":{"kind":"document","uri":"schemas/inputs/architecture-lift.input.example.json","title":"Architecture input lift smoke fixture","captured_at":"2026-04-25T00:00:00Z","source_local_id":"relations.billing_owns_billing_db"},"confidence":1.0,"review_status":"accepted","extraction_method":"architecture_input_lift.v1"}}]},"result":{"status":"lifted","accepted_fact_ids":["cell:order-service","cell:billing-service","cell:billing-db","incidence:order-service-reads-billing-db","incidence:billing-service-owns-billing-db"],"inferred_structure_ids":["candidate:billing-status-api-input"],"completion_candidates":[{"id":"candidate:billing-status-api-input","space_id":"space:architecture-product-input","missing_type":"cell","suggested_structure":{"structure_id":"cell:billing-status-api","structure_type":"api","summary":"Billing Service should expose a billing status query API.","related_ids":["cell:billing-service","cell:order-service","cell:billing-db"]},"inferred_from":["incidence:order-service-reads-billing-db"],"rationale":"Order Service needs billing status without directly reading Billing DB.","confidence":0.82,"review_status":"unreviewed"}]},"projection":{"audience":"human","purpose":"architecture_review","summary":"Lifted 5 accepted facts and preserved 1 inferred structures as unreviewed candidates.","recommended_actions":["Review completion candidates before promoting any inferred structure.","Extend input ingestion only after this bounded JSON path remains stable."],"information_loss":[{"description":"Projection summarizes accepted architecture facts and unreviewed inferred structures.","source_ids":["cell:order-service","cell:billing-service","cell:billing-db","incidence:order-service-reads-billing-db","incidence:billing-service-owns-billing-db","candidate:billing-status-api-input"]}],"source_ids":["cell:order-service","cell:billing-service","cell:billing-db","incidence:order-service-reads-billing-db","incidence:billing-service-owns-billing-db","candidate:billing-status-api-input"],"human_review":{"audience":"human","purpose":"architecture_review","summary":"Lifted 5 accepted facts and preserved 1 inferred structures as unreviewed candidates.","recommended_actions":["Review completion candidates before promoting any inferred structure.","Extend input ingestion only after this bounded JSON path remains stable."],"source_ids":["cell:order-service","cell:billing-service","cell:billing-db","incidence:order-service-reads-billing-db","incidence:billing-service-owns-billing-db","candidate:billing-status-api-input"],"information_loss":[{"description":"Projection summarizes accepted architecture facts and unreviewed inferred structures.","source_ids":["cell:order-service","cell:billing-service","cell:billing-db","incidence:order-service-reads-billing-db","incidence:billing-service-owns-billing-db","candidate:billing-status-api-input"]}]},"ai_view":{"audience":"ai_agent","purpose":"architecture_review","records":[{"id":"cell:order-service","record_type":"cell","summary":"Order Service","source_ids":["cell:order-service","space:architecture-product-input","context:orders"],"confidence":1.0,"review_status":"accepted","provenance":{"source":{"kind":"document","uri":"schemas/inputs/architecture-lift.input.example.json","title":"Architecture input lift smoke fixture","captured_at":"2026-04-25T00:00:00Z","source_local_id":"components.order_service"},"confidence":1.0,"review_status":"accepted","extraction_method":"architecture_input_lift.v1"}},{"id":"cell:billing-service","record_type":"cell","summary":"Billing Service","source_ids":["cell:billing-service","space:architecture-product-input","context:billing"],"confidence":1.0,"review_status":"accepted","provenance":{"source":{"kind":"document","uri":"schemas/inputs/architecture-lift.input.example.json","title":"Architecture input lift smoke fixture","captured_at":"2026-04-25T00:00:00Z","source_local_id":"components.billing_service"},"confidence":1.0,"review_status":"accepted","extraction_method":"architecture_input_lift.v1"}},{"id":"cell:billing-db","record_type":"cell","summary":"Billing DB","source_ids":["cell:billing-db","space:architecture-product-input","context:billing"],"confidence":1.0,"review_status":"accepted","provenance":{"source":{"kind":"document","uri":"schemas/inputs/architecture-lift.input.example.json","title":"Architecture input lift smoke fixture","captured_at":"2026-04-25T00:00:00Z","source_local_id":"components.billing_db"},"confidence":1.0,"review_status":"accepted","extraction_method":"architecture_input_lift.v1"}},{"id":"incidence:order-service-reads-billing-db","record_type":"incidence","summary":"cell:order-service reads_database cell:billing-db","source_ids":["incidence:order-service-reads-billing-db","space:architecture-product-input","cell:order-service","cell:billing-db"],"confidence":0.95,"review_status":"accepted","provenance":{"source":{"kind":"document","uri":"schemas/inputs/architecture-lift.input.example.json","title":"Architecture input lift smoke fixture","captured_at":"2026-04-25T00:00:00Z","source_local_id":"relations.order_reads_billing_db"},"confidence":0.95,"review_status":"accepted","extraction_method":"architecture_input_lift.v1"}},{"id":"incidence:billing-service-owns-billing-db","record_type":"incidence","summary":"cell:billing-service owns_database cell:billing-db","source_ids":["incidence:billing-service-owns-billing-db","space:architecture-product-input","cell:billing-service","cell:billing-db"],"confidence":1.0,"review_status":"accepted","provenance":{"source":{"kind":"document","uri":"schemas/inputs/architecture-lift.input.example.json","title":"Architecture input lift smoke fixture","captured_at":"2026-04-25T00:00:00Z","source_local_id":"relations.billing_owns_billing_db"},"confidence":1.0,"review_status":"accepted","extraction_method":"architecture_input_lift.v1"}},{"id":"candidate:billing-status-api-input","record_type":"completion_candidate","summary":"Billing Service should expose a billing status query API.","source_ids":["candidate:billing-status-api-input","space:architecture-product-input","cell:billing-status-api","cell:billing-service","cell:order-service","cell:billing-db","incidence:order-service-reads-billing-db"],"confidence":0.82,"review_status":"unreviewed"}],"source_ids":["cell:order-service","cell:billing-service","cell:billing-db","incidence:order-service-reads-billing-db","incidence:billing-service-owns-billing-db","candidate:billing-status-api-input"],"information_loss":[{"de